{
  "result_version": "ts-07-shared-smoke/1.0",
  "evidence_kind": "candidate_output",
  "candidate_denominator": false,
  "started_at": "2026-08-04T09:09:44.069Z",
  "candidate": {
    "implementation": "prototype/sound-demo.html",
    "browser_user_agent": "Mozilla/5.0 (Macintosh; Intel Mac OS X 10_15_7) AppleWebKit/537.36 (KHTML, like Gecko) Chrome/150.0.0.0 Safari/537.36",
    "external_requests": 0,
    "tokens_or_equivalent": 0,
    "cost_cny": 0
  },
  "runs": [
    {
      "name": "sound-main",
      "screen": "intro",
      "kind": "main",
      "before": {
        "ratio": 0.25066,
        "subtitle": "我们只把手指的力气变大，琴弦还是那一根。",
        "visibleCount": 2,
        "durationMs": 17760
      },
      "after": {
        "ratio": 0.252704,
        "subtitle": "我们只把手指的力气变大，琴弦还是那一根。",
        "visibleCount": 2,
        "errorCount": 1
      },
      "pausedRatio": 0.254579,
      "heldRatio": 0.254579,
      "resumedRatio": 0.259984,
      "monotonicHandoff": true,
      "subtitlePreserved": true,
      "visualStatePreserved": true,
      "pauseHeld": true,
      "resumeAdvanced": true,
      "oneError": true
    },
    {
      "name": "vacuum",
      "screen": "vacuum",
      "kind": "vacuum",
      "before": {
        "ratio": 0.251209,
        "subtitle": "先别急着回答听不听得到。我们把它拆成两步：",
        "visibleCount": 0,
        "durationMs": 13120
      },
      "after": {
        "ratio": 0.254159,
        "subtitle": "先别急着回答听不听得到。我们把它拆成两步：",
        "visibleCount": 0,
        "errorCount": 1
      },
      "pausedRatio": 0.256697,
      "heldRatio": 0.256697,
      "resumedRatio": 0.26273399999999997,
      "monotonicHandoff": true,
      "subtitlePreserved": true,
      "visualStatePreserved": true,
      "pauseHeld": true,
      "resumeAdvanced": true,
      "oneError": true
    }
  ],
  "pass": true,
  "completed_at": "2026-08-04T09:09:55.068Z"
}
